{
  "$schema":"https://json-schema.org/draft/2020-12/schema",
  "$id":"https://a-lang.invalid/schemas/compact-projection-fidelity/phase-02/tokenizer-runtime-v1.schema.json",
  "type":"object",
  "additionalProperties":false,
  "required":["format","implementation","provider_accounting","profiles","bounds","unknown_profile","aliases"],
  "properties":{
    "format":{"const":"alang-compact-tokenizer-runtime-v1"},
    "implementation":{"const":"beam-byte-pair-encoding-v1"},
    "provider_accounting":{"const":"authoritative-for-live-provider-and-full-request-metrics"},
    "profiles":{"type":"array","minItems":2,"maxItems":2,"items":{"type":"object","additionalProperties":false,"required":["id","encoding","vocabulary_file","vocabulary_sha256","mergeable_tokens","pretokenizer","pretokenizer_sha256"],"properties":{"id":{"enum":["tiktoken-0.12.0-cl100k-base","tiktoken-0.12.0-o200k-base"]},"encoding":{"enum":["cl100k_base","o200k_base"]},"vocabulary_file":{"enum":["cl100k_base.tiktoken","o200k_base.tiktoken"]},"vocabulary_sha256":{"type":"string","pattern":"^[0-9a-f]{64}$"},"mergeable_tokens":{"type":"integer","minimum":1},"pretokenizer":{"type":"string","minLength":1},"pretokenizer_sha256":{"type":"string","pattern":"^[0-9a-f]{64}$"}}}},
    "bounds":{"const":{"max_document_bytes":32768,"max_pretoken_bytes":32768}},
    "unknown_profile":{"const":"reject"},
    "aliases":{"const":[]}
  }
}
