{
  "format": "alang-compact-tokenizer-runtime-v1",
  "implementation": "beam-byte-pair-encoding-v1",
  "provider_accounting": "authoritative-for-live-provider-and-full-request-metrics",
  "profiles": [
    {
      "id": "tiktoken-0.12.0-cl100k-base",
      "encoding": "cl100k_base",
      "vocabulary_file": "cl100k_base.tiktoken",
      "vocabulary_sha256": "223921b76ee99bde995b7ff738513eef100fb51d18c93597a113bcffe865b2a7",
      "mergeable_tokens": 100256,
      "pretokenizer": "'(?i:[sdmt]|ll|ve|re)|[^\\r\\n\\p{L}\\p{N}]?+\\p{L}++|\\p{N}{1,3}+| ?[^\\s\\p{L}\\p{N}]++[\\r\\n]*+|\\s++$|\\s*[\\r\\n]|\\s+(?!\\S)|\\s",
      "pretokenizer_sha256": "f021c3d976978e62ee64cdad150cc3405c2e3d6e3b40407850bb9e8d9eb65899"
    },
    {
      "id": "tiktoken-0.12.0-o200k-base",
      "encoding": "o200k_base",
      "vocabulary_file": "o200k_base.tiktoken",
      "vocabulary_sha256": "446a9538cb6c348e3516120d7c08b09f57c36495e2acfffe59a5bf8b0cfb1a2d",
      "mergeable_tokens": 199998,
      "pretokenizer": "[^\\r\\n\\p{L}\\p{N}]?[\\p{Lu}\\p{Lt}\\p{Lm}\\p{Lo}\\p{M}]*[\\p{Ll}\\p{Lm}\\p{Lo}\\p{M}]+(?i:'s|'t|'re|'ve|'m|'ll|'d)?|[^\\r\\n\\p{L}\\p{N}]?[\\p{Lu}\\p{Lt}\\p{Lm}\\p{Lo}\\p{M}]+[\\p{Ll}\\p{Lm}\\p{Lo}\\p{M}]*(?i:'s|'t|'re|'ve|'m|'ll|'d)?|\\p{N}{1,3}| ?[^\\s\\p{L}\\p{N}]+[\\r\\n/]*|\\s*[\\r\\n]+|\\s+(?!\\S)|\\s+",
      "pretokenizer_sha256": "2d1b8dc11e89af71459b36004f698ab3693f59fd84f63e8ec2b49564ab857420"
    }
  ],
  "bounds": {"max_document_bytes":32768,"max_pretoken_bytes":32768},
  "unknown_profile": "reject",
  "aliases": []
}
